{
  "contract_version": "multimodal-qc-v1",
  "overall_result": "pass",
  "engine": "local_qwen_mnn",
  "provider": "qwen",
  "model_name": "Qwen3-VL-4B-Instruct-MNN",
  "confidence": 0.93,
  "items": [
    {
      "qc_point_id": "qp_001",
      "qc_point_code": "COLOR_MATCH",
      "name": "Color consistency",
      "result": "pass",
      "confidence": 0.95,
      "reason": "Color matches standard reference within tolerance."
    },
    {
      "qc_point_id": "qp_002",
      "qc_point_code": "LABEL_PRESENT",
      "name": "Label presence",
      "result": "pass",
      "confidence": 0.91,
      "reason": "Brand label fully visible and correctly positioned."
    }
  ],
  "fallback": {
    "used": false,
    "reason": null
  },
  "summary": "All QC points passed."
}
